post_id,title,author,score,created_utc,venue,subreddit
1e0xyrh,XSport Fitness is sold to LA Fitness,Minimum_Device_6379,609,2024-07-11 14:52:55,CLUB ABERDEEN INC,chicago
puzjvy,Quality Valet Practices at Summer House Santa Monica,SouthSideMaurice,99,2021-09-24 23:24:01,SUMMER HOUSE SANTA MONICA,chicago
1bbd8ck,Where to find fresh English muffins,kreplachkid,15,2024-03-10 10:40:52,SUMMER HOUSE SANTA MONICA,chicagofood
198nky4,Great Food and TV for Football,Logan__Squared,1,2024-01-16 22:12:17,SUMMER HOUSE SANTA MONICA,chicagofood
bk1tag,Date night restaurants,hg1975,39,2019-05-02 18:43:35,SUMMER HOUSE SANTA MONICA,chicagofood
